{
  "$schema": "http://json-schema.org/draft-07/schema#",
  "description": "",
  "type": "object",
  "properties": {
    "type": {
      "type": "string",
      "minLength": 1
    },
    "title": {
      "type": "string",
      "minLength": 1
    },
    "titleStyle": {
      "type": "object",
      "properties": {
        "align": {
          "type": "string",
          "minLength": 1
        },
        "bold": {
          "type": "boolean"
        },
        "font": {
          "type": "string",
          "minLength": 1
        },
        "italic": {
          "type": "boolean"
        },
        "size": {
          "type": "number"
        },
        "strikeOut": {
          "type": "boolean"
        },
        "underline": {
          "type": "boolean"
        }
      },
      "required": [
        "align",
        "bold",
        "font",
        "italic",
        "size",
        "strikeOut",
        "underline"
      ]
    },
    "backgroundColor": {
      "type": "string",
      "minLength": 1
    },
    "links": {
      "type": "array",
      "uniqueItems": true,
      "minItems": 1,
      "items": {
        "required": [
          "name",
          "path"
        ],
        "properties": {
          "name": {
            "type": "string",
            "minLength": 1
          },
          "path": {
            "type": "string",
            "minLength": 1
          }
        }
      }
    },
    "defaultRatio": {
      "type": "object",
      "properties": {
        "length": {
          "type": "number"
        },
        "width": {
          "type": "number"
        }
      },
      "required": [
        "length",
        "width"
      ]
    },
    "procedures": {
      "type": "array",
      "items": {
        "required": [],
        "properties": {}
      }
    },
    "axes": {
      "type": "array",
      "uniqueItems": true,
      "minItems": 1,
      "items": {
        "properties": {
          "label": {
            "type": "string",
            "minLength": 1
          },
          "id": {
            "type": "string",
            "minLength": 1
          },
          "unit": {
            "type": "string",
            "minLength": 1
          },
          "style": {
            "type": "object",
            "properties": {
              "font": {
                "type": "string",
                "minLength": 1
              },
              "size": {
                "type": "number"
              },
              "bold": {
                "type": "boolean"
              },
              "italic": {
                "type": "boolean"
              },
              "underline": {
                "type": "boolean"
              },
              "strikeOut": {
                "type": "boolean"
              },
              "align": {
                "type": "string",
                "minLength": 1
              },
              "color": {
                "type": "string",
                "minLength": 1
              }
            },
            "required": [
              "font",
              "size",
              "bold",
              "italic",
              "underline",
              "strikeOut",
              "align",
              "color"
            ]
          },
          "min": {
            "type": "number"
          },
          "max": {
            "type": "number"
          },
          "autoLimits": {
            "type": "boolean"
          },
          "tickStep": {
            "type": "number"
          },
          "autoTick": {
            "type": "boolean"
          },
          "showTicks": {
            "type": "boolean"
          },
          "showTickLabels": {
            "type": "boolean"
          },
          "logarithmic": {
            "type": "boolean"
          },
          "logSettings": {
            "type": "object",
            "properties": {
              "min": {
                "type": "number"
              },
              "max": {
                "type": "number"
              },
              "base": {
                "type": "number"
              }
            },
            "required": [
              "min",
              "max",
              "base"
            ]
          },
          "showAxis": {
            "type": "boolean"
          },
          "showLabels": {
            "type": "boolean"
          }
        }
      }
    },
    "grids": {
      "type": "array",
      "uniqueItems": true,
      "minItems": 1,
      "items": {
        "required": [
          "showGrid",
          "xAxisId",
          "yAxisId"
        ],
        "properties": {
          "showGrid": {
            "type": "boolean"
          },
          "line": {
            "type": "object",
            "properties": {
              "size": {
                "type": "number"
              },
              "style": {
                "type": "string",
                "minLength": 1
              }
            },
            "required": [
              "size",
              "style"
            ]
          },
          "xAxisId": {
            "type": "string",
            "minLength": 1
          },
          "yAxisId": {
            "type": "string",
            "minLength": 1
          }
        }
      }
    },
    "legend": {
      "type": "object",
      "properties": {
        "location": {
          "type": "string",
          "minLength": 1
        },
        "style": {
          "type": "object",
          "properties": {
            "font": {
              "type": "string",
              "minLength": 1
            },
            "size": {
              "type": "number"
            },
            "bold": {
              "type": "boolean"
            },
            "italic": {
              "type": "boolean"
            },
            "underline": {
              "type": "boolean"
            },
            "strikeOut": {
              "type": "boolean"
            },
            "align": {
              "type": "string",
              "minLength": 1
            },
            "color": {
              "type": "string",
              "minLength": 1
            }
          },
          "required": [
            "font",
            "size",
            "bold",
            "italic",
            "underline",
            "strikeOut",
            "align",
            "color"
          ]
        }
      },
      "required": [
        "location",
        "style"
      ]
    },
    "markers": {
      "type": "array",
      "uniqueItems": true,
      "minItems": 1,
      "items": {
        "required": [
          "kind",
          "label",
          "relativePosX",
          "relativePosY"
        ],
        "properties": {
          "kind": {
            "type": "string",
            "minLength": 1
          },
          "label": {
            "type": "string",
            "minLength": 1
          },
          "style": {
            "type": "object",
            "properties": {
              "font": {
                "type": "string",
                "minLength": 1
              },
              "size": {
                "type": "number"
              },
              "bold": {
                "type": "boolean"
              },
              "italic": {
                "type": "boolean"
              },
              "underline": {
                "type": "boolean"
              },
              "strikeOut": {
                "type": "boolean"
              },
              "align": {
                "type": "string",
                "minLength": 1
              },
              "color": {
                "type": "string",
                "minLength": 1
              }
            },
            "required": [
              "font",
              "size",
              "bold",
              "italic",
              "underline",
              "strikeOut",
              "align",
              "color"
            ]
          },
          "relativePosX": {
            "type": "number"
          },
          "relativePosY": {
            "type": "number"
          }
        }
      }
    },
    "entryPoints": {
      "type": "array",
      "uniqueItems": true,
      "minItems": 1,
      "items": {
        "required": [
          "name"
        ],
        "properties": {
          "connectedData": {
            "type": "object",
            "properties": {
              "axisId": {
                "type": "string",
                "minLength": 1
              },
              "catalog": {
                "type": "string",
                "minLength": 1
              },
              "catalogItem": {
                "type": "string",
                "minLength": 1
              },
              "comObject": {
                "type": "string",
                "minLength": 1
              },
              "comObjectField": {
                "type": "string",
                "minLength": 1
              },
              "convertFrom": {
                "type": "string"
              },
              "convertTo": {
                "type": "string"
              },
              "defaultY": {
                "type": "number"
              },
              "digits": {
                "type": "number"
              },
              "domain": {
                "type": "string",
                "minLength": 1
              },
              "fieldX": {
                "type": "string",
                "minLength": 1
              },
              "filter": {
                "type": "array",
                "uniqueItems": true,
                "items": {
                  "required": [
                    "field",
                    "operand",
                    "operator"
                  ],
                  "properties": {
                    "field": {
                      "type": "string",
                      "minLength": 1
                    },
                    "operand": {
                      "type": "string",
                      "minLength": 1
                    },
                    "operator": {
                      "type": "string",
                      "minLength": 1
                    }
                  }
                }
              },
              "format": {
                "type": "string",
                "minLength": 1
              },
              "formula": {
                "type": "string",
                "minLength": 1
              },
              "provider": {
                "type": "string",
                "minLength": 1
              },
              "stringParameter": {
                "type": "boolean"
              },
              "timeline": {
                "type": "string",
                "minLength": 1
              },
              "unit": {
                "type": "string",
                "minLength": 1
              }
            },
            "required": [
              "digits",
              "domain",
              "fieldX",
              "format",
              "formula",
              "provider",
              "stringParameter",
              "timeline",
              "unit"
            ]
          },
          "connectedDataParametric": {
            "type": "object",
            "properties": {
              "domainX": {
                "type": "string"
              },
              "domainY": {
                "type": "string"
              },
              "formulaX": {
                "type": "string"
              },
              "formulaY": {
                "type": "string"
              },
              "unitX": {
                "type": "string"
              },
              "unitY": {
                "type": "string"
              },
              "xAxisId": {
                "type": "string"
              },
              "yAxisId": {
                "type": "string"
              }
            },
            "required": [
              "domainX",
              "domainY",
              "formulaX",
              "formulaY",
              "unitX",
              "unitY",
              "xAxisId",
              "yAxisId"
            ]
          },
          "name": {
            "type": "string",
            "minLength": 1
          },
          "objectStyle": {
            "type": "object",
            "properties": {
              "curveColor": {
                "type": "string",
                "minLength": 1
              },
              "line": {
                "type": "object",
                "properties": {
                  "size": {
                    "type": "number"
                  },
                  "style": {
                    "type": "string",
                    "minLength": 1
                  }
                },
                "required": [
                  "size",
                  "style"
                ]
              },
              "points": {
                "type": "object",
                "properties": {
                  "size": {
                    "type": "number"
                  },
                  "style": {
                    "type": "string",
                    "minLength": 1
                  }
                },
                "required": [
                  "size",
                  "style"
                ]
              }
            },
            "required": [
              "curveColor",
              "line",
              "points"
            ]
          },
          "parametric": {
            "type": "boolean"
          },
          "stateColors": {
            "type": "array",
            "items": {
              "required": [],
              "properties": {}
            }
          }
        }
      }
    },
    "showYAxes": {
      "type": "string",
      "minLength": 1
    },
    "showLegend": {
      "type": "boolean"
    },
    "search": {
      "type": "string"
    }
  },
  "required": [
    "type",
    "title"
  ]
}
