{
  "type": "PlotView",
  "links": [
    {
      "name": "pagePBF1",
      "path": "./pages/pagePBF1.json"
    }
  ],
  "procedures": [],
  "defaultRatio": {
    "length": 50,
    "width": 50
  },
  "entryPoints": [
    {
      "name": "ATT_BC_REVTCOUNT1",
      "connectedDataX": {
        "formula": "Reporting.ATT_BC_REVTCOUNT1<ReportingParameter>.convertedValue",
        "unit": "s",
        "digits": 5,
        "format": "decimal",
        "domain": "fr.cnes.isis.simupus",
        "timeline": "Session 1",
        "axisId": "Time"
      },
      "connectedDataY": {
        "formula": "Reporting.ATT_BC_REVTCOUNT1<ReportingParameter>.convertedValue",
        "unit": "V",
        "digits": 5,
        "format": "decimal",
        "domain": "fr.cnes.isis.simupus",
        "timeline": "Session 1",
        "axisId": "VBat"
      },
      "objectStyle": {
        "line": {
          "style": "Continuous",
          "size": 2
        },
        "points": {
          "style": "None",
          "size": 0
        },
        "curveColor": "#424242"
      },
      "stateColors": [
        {
          "color": "#000000",
          "condition": {
            "field": "monitoringState",
            "operator": "==",
            "operand": "waiting"
          }
        }
      ]
    },
    {
      "name": "ATT_BC_REVTCOUNT2",
      "connectedDataX": {
        "formula": "Reporting.ATT_BC_REVTCOUNT2<ReportingParameter>.convertedValue",
        "unit": "s",
        "digits": 5,
        "format": "decimal",
        "domain": "fr.cnes.isis.simupus",
        "timeline": "Session 1",
        "axisId": "Time"
      },
      "connectedDataY": {
        "formula": "Reporting.ATT_BC_REVTCOUNT2<ReportingParameter>.convertedValue",
        "unit": "V",
        "digits": 5,
        "format": "decimal",
        "domain": "fr.cnes.isis.simupus",
        "timeline": "Session 1",
        "axisId": "VBat"
      },
      "objectStyle": {
        "line": {
          "style": "Continuous",
          "size": 2
        },
        "points": {
          "style": "None",
          "size": 0
        },
        "curveColor": "#58FA58"
      },
      "stateColors": [
        {
          "color": "#000000",
          "condition": {
            "field": "monitoringState",
            "operator": "==",
            "operand": "waiting"
          }
        }
      ]
    },
    {
      "name": "ATT_BC_REVTCOUNT3",
      "connectedDataX": {
        "formula": "Reporting.ATT_BC_REVTCOUNT3<ReportingParameter>.convertedValue",
        "unit": "s",
        "digits": 5,
        "format": "decimal",
        "domain": "fr.cnes.isis.simupus",
        "timeline": "Session 1",
        "axisId": "Time"
      },
      "connectedDataY": {
        "formula": "Reporting.ATT_BC_REVTCOUNT3<ReportingParameter>.convertedValue",
        "unit": "V",
        "digits": 5,
        "format": "decimal",
        "domain": "fr.cnes.isis.simupus",
        "timeline": "Session 1",
        "axisId": "VBat"
      },
      "objectStyle": {
        "line": {
          "style": "Continuous",
          "size": 2
        },
        "points": {
          "style": "None",
          "size": 0
        },
        "curveColor": "#F7BE81"
      },
      "stateColors": [
        {
          "color": "#000000",
          "condition": {
            "field": "monitoringState",
            "operator": "==",
            "operand": "waiting"
          }
        }
      ]
    },
    {
      "name": "ATT_BC_REVTCOUNT4",
      "connectedDataX": {
        "formula": "Reporting.ATT_BC_REVTCOUNT4<ReportingParameter>.convertedValue",
        "unit": "s",
        "digits": 5,
        "format": "decimal",
        "domain": "fr.cnes.isis.simupus",
        "timeline": "Session 1",
        "axisId": "Time"
      },
      "connectedDataY": {
        "formula": "Reporting.ATT_BC_REVTCOUNT4<ReportingParameter>.convertedValue",
        "unit": "V",
        "digits": 5,
        "format": "decimal",
        "domain": "fr.cnes.isis.simupus",
        "timeline": "Session 1",
        "axisId": "VBat"
      },
      "objectStyle": {
        "line": {
          "style": "Continuous",
          "size": 2
        },
        "points": {
          "style": "None",
          "size": 0
        },
        "curveColor": "#DF013A"
      },
      "stateColors": [
        {
          "color": "#000000",
          "condition": {
            "field": "monitoringState",
            "operator": "==",
            "operand": "waiting"
          }
        }
      ]
    }
  ],
  "axes": [
    {
      "label": "Time",
      "unit": "<DATE>",
      "style": {
        "font": "Arial",
        "size": 12,
        "bold": false,
        "italic": false,
        "underline": false,
        "strikeOut": false,
        "align": "left",
        "color": "#000000"
      },
      "min": 0,
      "max": 10,
      "autoLimits": true,
      "tickStep": 0.5,
      "autoTick": true,
      "showTicks": true,
      "showTickLabels": true,
      "isLogarithmic": false,
      "showAxis": true
    },
    {
      "label": "VBat",
      "unit": "V",
      "style": {
        "font": "Arial",
        "size": 12,
        "bold": false,
        "italic": false,
        "underline": false,
        "strikeOut": false,
        "align": "left",
        "color": "#000000"
      },
      "min": -300,
      "max": 300,
      "autoLimits": false,
      "tickStep": 50,
      "autoTick": false,
      "showTicks": true,
      "showTickLabels": true,
      "isLogarithmic": false,
      "showAxis": true
    }
  ],
  "grids": [
    {
      "xAxisId": "Time",
      "yAxisId": "VBat",
      "line": {
        "style": "Continuous",
        "size": 1
      },
      "showGrid": true
    }
  ],
  "title": "Validation Plotview 4 parameters",
  "titleStyle": {
    "font": "Arial",
    "size": 12,
    "bold": false,
    "italic": false,
    "underline": true,
    "strikeOut": false,
    "align": "center",
    "color": "#000000"
  },
  "backgroundColor": "#FFFFFF",
  "showYAxes": "left",
  "legend": {
    "style": {
      "font": "Arial",
      "size": 12,
      "bold": false,
      "italic": false,
      "underline": false,
      "strikeOut": false,
      "align": "left",
      "color": "#000000"
    },
    "location": "top"
  },
  "markers": [
    {
      "kind": "Text",
      "label": "VBAT",
      "style": {
        "font": "Arial",
        "size": 12,
        "bold": false,
        "italic": false,
        "underline": true,
        "strikeOut": false,
        "align": "left",
        "color": "#000000"
      },
      "relativePosX": 5.6,
      "relativePosY": 8.9
    }
  ]
  }
