{
  "type": "PlotView",
  "links": [
    {
      "name": "page4",
      "path": "./pages/page4.json"
    }
  ],
  "procedures": [],
  "defaultRatio": {
    "length": 50,
    "width": 50
  },
  "entryPoints": [
    {
      "name": "TMMGT_BC_VIRTCHAN3",
      "connectedDataX": {
        "formula": "Reporting.TMMGT_BC_VIRTCHAN3<ReportingParameter>.groundDate",
        "unit": "s",
        "digits": 5,
        "format": "decimal",
        "filter": [],
        "domain": "fr.cnes.isis.simupus",
        "timeline": "Session 1",
        "axisId": "Time"
      },
      "connectedDataY": {
        "formula": "Reporting.TMMGT_BC_VIRTCHAN3<ReportingParameter>.extractedValue",
        "unit": "V",
        "digits": 5,
        "format": "decimal",
        "filter": [],
        "domain": "fr.cnes.isis.simupus",
        "timeline": "Session 1",
        "axisId": "VBat"
      },
      "objectStyle": {
        "line": {
          "style": "Continuous",
          "size": 2
        },
        "points": {
          "style": "None",
          "size": 0
        },
        "curveColor": "#FFBF00"
      },
      "stateColors": [
        {
          "color": "#000000",
          "condition": {
            "field": "monitoringState",
            "operator": "==",
            "operand": "waiting"
          }
        }
      ]
    },
    {
      "name": "ATT_BC_REVTCOUNT1",
      "connectedDataX": {
        "formula": "Reporting.ATT_BC_REVTCOUNT1<ReportingParameter>.groundDate",
        "unit": "s",
        "digits": 5,
        "format": "decimal",
        "filter": [],
        "domain": "fr.cne",
        "timeline": "Session 1",
        "axisId": "Time"
      },
      "connectedDataY": {
        "formula": "Reporting.ATT_BC_REVTCOUNT1<ReportingParameter>.extractedValue",
        "unit": "V",
        "digits": 5,
        "format": "decimal",
        "filter": [],
        "domain": "fr.cnes.isis",
        "timeline": "Session 1",
        "axisId": "att_bc_revtcount_1_1"
      },
      "objectStyle": {
        "line": {
          "style": "Continuous",
          "size": 3
        },
        "points": {
          "style": "None",
          "size": 3
        },
        "curveColor": "#ff9800"
      },
      "stateColors": []
    }
  ],
  "axes": [
    {
      "label": "Time",
      "unit": "s",
      "style": {
        "font": "Arial",
        "size": 12,
        "bold": false,
        "italic": false,
        "underline": false,
        "strikeOut": false,
        "align": "left",
        "color": "#000000"
      },
      "min": 0,
      "max": 10,
      "autoLimits": true,
      "tickStep": 0.5,
      "autoTick": true,
      "showTicks": true,
      "showTickLabels": true,
      "isLogarithmic": false,
      "showAxis": true
    },
    {
      "label": "VBat",
      "unit": "V",
      "style": {
        "font": "Arial",
        "size": 12,
        "bold": false,
        "italic": false,
        "underline": false,
        "strikeOut": false,
        "align": "left",
        "color": "#000000"
      },
      "min": -300,
      "max": 300,
      "autoLimits": false,
      "tickStep": 50,
      "autoTick": false,
      "showTicks": true,
      "showTickLabels": true,
      "isLogarithmic": false,
      "showAxis": true
    },
    {
      "label": "ATT_BC_REVTCOUNT1",
      "unit": "s",
      "id": "att_bc_revtcount_1"
    },
    {
      "label": "ATT_BC_REVTCOUNT1",
      "unit": "V",
      "id": "att_bc_revtcount_1_1"
    }
  ],
  "grids": [
    {
      "xAxisId": "Time",
      "yAxisId": "VBat",
      "line": {
        "style": "Continuous",
        "size": 1
      },
      "showGrid": true
    }
  ],
  "title": "Plotview One parameter",
  "titleStyle": {
    "font": "Arial",
    "size": 12,
    "bold": false,
    "italic": false,
    "underline": true,
    "strikeOut": false,
    "align": "center",
    "color": "#000000"
  },
  "backgroundColor": "#FFFFFF",
  "showYAxes": "left",
  "legend": {
    "style": {
      "font": "Arial",
      "size": 12,
      "bold": false,
      "italic": false,
      "underline": false,
      "strikeOut": false,
      "align": "left",
      "color": "#000000"
    },
    "location": "top"
  },
  "markers": [
    {
      "kind": "Text",
      "label": "VBAT",
      "style": {
        "font": "Arial",
        "size": 12,
        "bold": false,
        "italic": false,
        "underline": true,
        "strikeOut": false,
        "align": "left",
        "color": "#000000"
      },
      "relativePosX": 5.6,
      "relativePosY": 8.9
    }
  ]
}